{
  "format": "md-model/1",
  "key": "AN/HH",
  "version": "1.0.0",
  "kit_abi": 1,
  "injection": {
    "mode": "add"
  },
  "panel": {
    "name": "AN HH",
    "category": "AN",
    "knobs": [
      {
        "label": "PTCH",
        "default": 64
      },
      {
        "label": "DEC",
        "default": 64
      },
      {
        "label": "MODE",
        "default": 0
      },
      {
        "label": "TONE",
        "default": 64
      },
      {
        "label": "COL",
        "default": 64
      },
      {
        "label": "TDEC",
        "default": 120
      },
      {
        "label": "OSC5",
        "default": 64
      },
      {
        "label": "BEND",
        "default": 64
      }
    ],
    "modes": [
      {
        "knob": 2,
        "zones": [
          {
            "min": 0,
            "max": 21,
            "labels": {
              "2": "CHCL"
            }
          },
          {
            "min": 22,
            "max": 42,
            "labels": {
              "2": "OHCL"
            }
          },
          {
            "min": 43,
            "max": 63,
            "labels": {
              "2": "CHMT"
            }
          },
          {
            "min": 64,
            "max": 85,
            "labels": {
              "2": "OHMT"
            }
          },
          {
            "min": 86,
            "max": 106,
            "labels": {
              "2": "HHBA"
            }
          },
          {
            "min": 107,
            "max": 127,
            "labels": {
              "0": "OSC1",
              "3": "OSC2",
              "4": "OSC3",
              "5": "OSC4",
              "6": "OSC5",
              "7": "OSC6",
              "2": "HHLB"
            }
          }
        ]
      }
    ]
  },
  "components": {
    "dsp2": {
      "source": "dsp2.asm",
      "tables": "tables.asm",
      "abi": "md-voice/1"
    },
    "dsp1_drive": {
      "source": "dsp1-drive.asm",
      "law": "an_cubicd",
      "abi": "md-track-drive/1"
    }
  },
  "memory": [
    {
      "kind": "voice",
      "space": "XY",
      "words": 64,
      "alignment": 64,
      "lifetime": "track-assignment",
      "init": "model",
      "release": "successor-init"
    }
  ],
  "samples": [],
  "budget": {
    "render_cps": 256,
    "trigger_cycles": 1000,
    "init_cycles": 1000,
    "dsp1_cps": 20
  },
  "provenance": [
    {
      "origin": "Original digital recreation of Syntakt and Analog Rytm analog voice designs",
      "license": "NOASSERTION",
      "reference": "Analog Rytm and Syntakt manuals; parameter ranges and defaults informed by device metadata"
    }
  ]
}
