{
  "format": "md-model/1",
  "key": "WAV/SP",
  "aliases": [
    "COMM/E12SP"
  ],
  "version": "1.0.0",
  "kit_abi": 1,
  "injection": {
    "mode": "add"
  },
  "panel": {
    "name": "WAVSP",
    "category": "COM",
    "knobs": [
      {
        "label": "PTCH",
        "default": 48
      },
      {
        "label": "DEC",
        "default": 64
      },
      {
        "label": "ARRY",
        "default": 48
      },
      {
        "label": "TILT",
        "default": 64
      },
      {
        "label": "PART",
        "default": 92
      },
      {
        "label": "FOCS",
        "default": 48
      },
      {
        "label": "SCAN",
        "default": 0
      },
      {
        "label": "",
        "default": 0
      }
    ],
    "modes": []
  },
  "components": {
    "dsp2": {
      "source": "dsp2.asm",
      "tables": "tables.asm",
      "abi": "md-voice/1"
    }
  },
  "memory": [
    {
      "kind": "voice",
      "space": "XY",
      "words": 64,
      "alignment": 64,
      "lifetime": "track-assignment",
      "init": "model",
      "release": "successor-init"
    },
    {
      "kind": "private",
      "space": "X",
      "words": 153,
      "alignment": 128,
      "lifetime": "track-assignment",
      "init": "model",
      "release": "successor-init"
    }
  ],
  "samples": [],
  "budget": {
    "render_cps": 500,
    "trigger_cycles": 64,
    "init_cycles": 500
  },
  "provenance": [
    {
      "origin": "Community Spectra v79 synthesis and update core",
      "license": "GPL-3.0-or-later",
      "reference": "Original Machinedrum voice by Nick Montgomery (E12-SP v79), ported to an md-model/1 add-on"
    },
    {
      "origin": "Original two 64x24 spectral banks and note table",
      "license": "GPL-3.0-or-later",
      "reference": "Taken unchanged from the original E12-SP voice; the note table is repeated across four octaves"
    }
  ]
}
