{
  "format": "md-model/1",
  "key": "AN/PC",
  "version": "1.0.0",
  "kit_abi": 1,
  "injection": {
    "mode": "add"
  },
  "panel": {
    "name": "AN PC",
    "category": "AN",
    "knobs": [
      {
        "label": "PTCH",
        "default": 64
      },
      {
        "label": "DEC",
        "default": 63
      },
      {
        "label": "MODE",
        "default": 0
      },
      {
        "label": "TON",
        "default": 64
      },
      {
        "label": "NLEV",
        "default": 0
      },
      {
        "label": "NDEC",
        "default": 64
      },
      {
        "label": "DRIV",
        "default": 0
      },
      {
        "label": "BEND",
        "default": 64
      }
    ],
    "modes": [
      {
        "knob": 2,
        "zones": [
          {
            "min": 0,
            "max": 21,
            "labels": {
              "5": "SNAP",
              "2": "BT"
            }
          },
          {
            "min": 22,
            "max": 42,
            "labels": {
              "2": "XTLO"
            }
          },
          {
            "min": 43,
            "max": 63,
            "labels": {
              "2": "XTMD"
            }
          },
          {
            "min": 64,
            "max": 85,
            "labels": {
              "2": "XTHI"
            }
          },
          {
            "min": 86,
            "max": 106,
            "labels": {
              "2": "CNGA"
            }
          },
          {
            "min": 107,
            "max": 127,
            "labels": {
              "2": "PING"
            }
          }
        ]
      }
    ]
  },
  "components": {
    "dsp2": {
      "source": "dsp2.asm",
      "tables": "tables.asm",
      "abi": "md-voice/1"
    }
  },
  "memory": [
    {
      "kind": "voice",
      "space": "XY",
      "words": 64,
      "alignment": 64,
      "lifetime": "track-assignment",
      "init": "model",
      "release": "successor-init"
    }
  ],
  "samples": [],
  "budget": {
    "render_cps": 256,
    "trigger_cycles": 1000,
    "init_cycles": 1000
  },
  "provenance": [
    {
      "origin": "Original digital recreation of Syntakt and Analog Rytm analog voice designs",
      "license": "NOASSERTION",
      "reference": "Analog Rytm and Syntakt manuals; parameter ranges and defaults informed by device metadata"
    }
  ]
}
