{
  "format": "md-model/1",
  "key": "VAD/SY",
  "aliases": [
    "AN/SY"
  ],
  "version": "2.0.0",
  "kit_abi": 1,
  "injection": {
    "mode": "add"
  },
  "panel": {
    "name": "VADSY",
    "category": "AN",
    "knobs": [
      {
        "label": "PTCH",
        "default": 80
      },
      {
        "label": "DEC",
        "default": 72
      },
      {
        "label": "MODE",
        "default": 38
      },
      {
        "label": "DET",
        "default": 52
      },
      {
        "label": "TIMB",
        "default": 83
      },
      {
        "label": "BAL",
        "default": 64
      },
      {
        "label": "DEC2",
        "default": 72
      },
      {
        "label": "BEND",
        "default": 64
      }
    ],
    "modes": [
      {
        "knob": 2,
        "zones": [
          {
            "min": 0,
            "max": 11,
            "labels": {
              "1": "DEC1",
              "4": "CNFG",
              "5": "BAL",
              "2": "D+"
            }
          },
          {
            "min": 12,
            "max": 23,
            "labels": {
              "1": "DEC1",
              "4": "CNFG",
              "5": "RING",
              "2": "DR"
            }
          },
          {
            "min": 24,
            "max": 34,
            "labels": {
              "1": "DEC1",
              "4": "CNFG",
              "5": "FM",
              "2": "DFM"
            }
          },
          {
            "min": 35,
            "max": 46,
            "labels": {
              "1": "DEC1",
              "4": "CNFG",
              "5": "FM",
              "2": "DF+R"
            }
          },
          {
            "min": 47,
            "max": 58,
            "labels": {
              "1": "DEC1",
              "4": "CNFG",
              "5": "BAL",
              "2": "D+T"
            }
          },
          {
            "min": 59,
            "max": 69,
            "labels": {
              "1": "DEC1",
              "4": "CNFG",
              "5": "RING",
              "2": "DRT"
            }
          },
          {
            "min": 70,
            "max": 81,
            "labels": {
              "1": "DEC1",
              "4": "CNFG",
              "5": "FM",
              "2": "DFMT"
            }
          },
          {
            "min": 82,
            "max": 93,
            "labels": {
              "1": "DEC1",
              "4": "CNFG",
              "5": "FM",
              "2": "DFRT"
            }
          },
          {
            "min": 94,
            "max": 104,
            "labels": {
              "1": "DEC1",
              "4": "W1W2",
              "5": "LEV2",
              "2": "OSC"
            }
          },
          {
            "min": 105,
            "max": 116,
            "labels": {
              "1": "DEC1",
              "4": "W1W2",
              "5": "LEV2",
              "2": "OSCT"
            }
          },
          {
            "min": 117,
            "max": 127,
            "labels": {
              "3": "CHRD",
              "4": "WAVE",
              "5": "SPD",
              "6": "SDEC",
              "2": "BITS"
            }
          }
        ]
      }
    ],
    "pitch": {
      "knob": 0,
      "law": "quarter",
      "steps": 2,
      "base_note": 24
    }
  },
  "components": {
    "dsp2": {
      "source": "dsp2.asm",
      "tables": "tables.asm",
      "abi": "md-voice/1"
    }
  },
  "memory": [
    {
      "kind": "voice",
      "space": "XY",
      "words": 64,
      "alignment": 64,
      "lifetime": "track-assignment",
      "init": "model",
      "release": "successor-init"
    }
  ],
  "samples": [],
  "budget": {
    "render_cps": 256,
    "trigger_cycles": 1000,
    "init_cycles": 1000
  },
  "provenance": [
    {
      "origin": "Original digital drum voices",
      "license": "GPL-3.0-or-later",
      "reference": "Original DSP code and mathematically generated tables; no recovered engine code"
    }
  ]
}
