{
  "format": "md-model/1",
  "key": "AN/SD",
  "version": "1.0.0",
  "kit_abi": 1,
  "injection": {
    "mode": "add"
  },
  "panel": {
    "name": "AN SD",
    "category": "AN",
    "knobs": [
      {
        "label": "PTCH",
        "default": 64
      },
      {
        "label": "DEC",
        "default": 76
      },
      {
        "label": "MODE",
        "default": 0
      },
      {
        "label": "NOIS",
        "default": 104
      },
      {
        "label": "TONE",
        "default": 64
      },
      {
        "label": "SNAP",
        "default": 64
      },
      {
        "label": "DRIV",
        "default": 0
      },
      {
        "label": "BEND",
        "default": 64
      }
    ],
    "modes": [
      {
        "knob": 2,
        "zones": [
          {
            "min": 0,
            "max": 25,
            "labels": {
              "4": "DET",
              "5": "TICK",
              "2": "HARD"
            }
          },
          {
            "min": 26,
            "max": 51,
            "labels": {
              "4": "DET",
              "7": "BAL",
              "2": "CLAS"
            }
          },
          {
            "min": 52,
            "max": 76,
            "labels": {
              "4": "FM T",
              "5": "FM A",
              "2": "FM"
            }
          },
          {
            "min": 77,
            "max": 102,
            "labels": {
              "4": "LPF",
              "5": "HPF",
              "2": "NAT"
            }
          },
          {
            "min": 103,
            "max": 127,
            "labels": {
              "4": "HOLD",
              "5": "IMP",
              "2": "ACOU"
            }
          }
        ]
      }
    ]
  },
  "components": {
    "dsp2": {
      "source": "dsp2.asm",
      "tables": "tables.asm",
      "abi": "md-voice/1"
    }
  },
  "memory": [
    {
      "kind": "voice",
      "space": "XY",
      "words": 64,
      "alignment": 64,
      "lifetime": "track-assignment",
      "init": "model",
      "release": "successor-init"
    }
  ],
  "samples": [],
  "budget": {
    "render_cps": 256,
    "trigger_cycles": 1000,
    "init_cycles": 1000
  },
  "provenance": [
    {
      "origin": "Original digital recreation of Syntakt and Analog Rytm analog voice designs",
      "license": "NOASSERTION",
      "reference": "Analog Rytm and Syntakt manuals; parameter ranges and defaults informed by device metadata"
    }
  ]
}
